{
  "$schema": "https://json-schema.org/draft/2020-12/schema",
  "$id": "https://example.invalid/schema/pay-policy-1.json",
  "title": "pay-policy/1",
  "description": "A vendor-neutral payment policy for an agent. Every figure is a whole number of minor units with an explicit currency code; floats are refused. The schema holds the shape; vendor-pay-policy.mjs holds what a schema cannot say: every money figure shares the policy's currency, a spending policy's humanApprovalAbove is strictly below perTransaction, and a child policy only narrows its parent.",
  "type": "object",
  "additionalProperties": false,
  "patternProperties": {
    "^x-": {}
  },
  "required": ["contract", "id", "holder", "currency", "limits", "allow"],
  "properties": {
    "contract": { "const": "pay-policy/1" },
    "id": { "type": "string", "minLength": 1, "description": "This policy's own identifier." },
    "holder": { "type": "string", "minLength": 1, "description": "Who this policy binds. An opaque reference; who may hold a policy is delegation/1's question, not this format's." },
    "parent": { "type": "string", "minLength": 1, "description": "The id of the policy this one attenuates. Required by attenuate(parent, child); absent on a root policy." },
    "currency": { "$ref": "#/$defs/currencyCode", "description": "The currency every figure in this policy is denominated in." },
    "limits": {
      "type": "object",
      "additionalProperties": false,
      "required": ["perTransaction"],
      "properties": {
        "perTransaction": { "$ref": "#/$defs/money", "description": "Inclusive ceiling per payment. 0 closes the policy: it can pay nobody anything." },
        "perPeriod": {
          "type": "object",
          "additionalProperties": false,
          "required": ["period", "cap"],
          "properties": {
            "period": { "enum": ["day", "week", "month"] },
            "cap": { "$ref": "#/$defs/money", "description": "Inclusive ceiling on spent-so-far plus this payment within the period." }
          }
        }
      }
    },
    "allow": {
      "type": "object",
      "additionalProperties": false,
      "required": ["counterparties", "rails"],
      "properties": {
        "counterparties": { "$ref": "#/$defs/stringList", "description": "Exact-match allowlist. Empty permits no counterparty. No wildcard exists." },
        "rails": {
          "type": "array",
          "uniqueItems": true,
          "items": { "type": "string", "pattern": "^[a-z0-9][a-z0-9-]{0,63}$" },
          "description": "Opaque lowercase rail identifiers the payment may travel on. The format names no rail."
        },
        "jurisdictions": {
          "type": "array",
          "uniqueItems": true,
          "items": { "type": "string", "pattern": "^[A-Z]{2}$" },
          "description": "Two-letter uppercase codes. Absent means unrestricted; present means a payment naming none is denied."
        }
      }
    },
    "humanApprovalAbove": { "$ref": "#/$defs/money", "description": "A payment strictly above this escalates to a person. 0 escalates everything. Required whenever perTransaction is above 0." }
  },
  "if": {
    "properties": { "limits": { "properties": { "perTransaction": { "properties": { "minor": { "minimum": 1 } } } } } }
  },
  "then": {
    "required": ["humanApprovalAbove"]
  },
  "$defs": {
    "currencyCode": { "type": "string", "pattern": "^[A-Z][A-Z0-9]{2,11}$" },
    "money": {
      "type": "object",
      "additionalProperties": false,
      "required": ["minor", "currency"],
      "properties": {
        "minor": { "type": "integer", "minimum": 0, "maximum": 9007199254740991, "description": "A whole number of minor units (2500 = 25.00 in a two-decimal currency)." },
        "currency": { "$ref": "#/$defs/currencyCode" }
      }
    },
    "stringList": {
      "type": "array",
      "uniqueItems": true,
      "items": { "type": "string", "minLength": 1 }
    }
  }
}
