{
  "contract": "pay-policy/1",
  "id": "policy/treasury/sub-agent-a",
  "holder": "agent/sub-agent-a",
  "parent": "policy/treasury",
  "currency": "USD",
  "limits": {
    "perTransaction": { "minor": 25000, "currency": "USD" },
    "perPeriod": { "period": "month", "cap": { "minor": 200000, "currency": "USD" } }
  },
  "allow": {
    "counterparties": ["merchant/acme-cloud"],
    "rails": ["x402"],
    "jurisdictions": ["US"]
  },
  "humanApprovalAbove": { "minor": 10000, "currency": "USD" }
}
