{
  "contract": "pay-policy/1",
  "id": "policy/research-ops",
  "holder": "agent/research-ops",
  "currency": "USD",
  "limits": {
    "perTransaction": { "minor": 50000, "currency": "USD" },
    "perPeriod": { "period": "month", "cap": { "minor": 500000, "currency": "USD" } }
  },
  "allow": {
    "counterparties": ["merchant/acme-cloud", "merchant/example-data"],
    "rails": ["x402", "card"]
  },
  "humanApprovalAbove": { "minor": 20000, "currency": "USD" }
}
